Start hr:min:sec,End hr:min:sec,Transcription,Annotation,Layer,Index
,,"GA: See this thing coming down, let me see your other hand. No, instead of curving down it curves up.",,,Instructional
,,CS: This may be stuff coming up.,,,
,,"GA: I don’t know, it's just someone told me that. You’ve got lots of creativity. No? What are these?",,,Creativity
,,"CS: Yeah, that’s a big X.",,,
,,"GA: Y aqui? Communication. What is this big X, you have it over here, too.",,,Communication
,,"CS: Yeah, same thing.",,,
,,GA: Did your mother tell you?,,,
,,"CS: It’s communication. No, uh uh. But I had a lot of stuff to work out about love. And…",,,Relationships
,,GA: Well this–,,,
,,CS: mmhmm. I came in with a good mind but my intellect is not as developed in this life as I had the potential to have it be.,,,Intellect
,,"GA: I think its very developed, no?",,,
,,"CS: Well, I mean because of the work I do it forces me to think but actually I had kind of a traumatic childhood. See I have these nervous energy lines that come up past my life line. And they cross my head line and make this island here and continue over and cross my heart line and reach up to my health line here.",,,"Head Line, Heart Line, Health Line (is health line different from life line?)"
,,GA: And these are all nervous lines?,,,Nervous Lines?
,,"CS: This is a nervous energy line that crosses all the way over here, and it makes an island here which shows a type of insanity that occurred, and I think that affected my ability–my intellectual abilities–because this line is not as long as it is on my other hand. On my other hand it comes all the way to here. It stops here. And it’s also not clear, and that break in it–see how yours is clear and straight? That shows that you can think clearly. So I had some damage here in my life that I have to overcome. And here, you can see some of the stuff around my heart.",,,"Intellect, Instructional, Heart Line"
,,"GA: Bueno, and this is your health line?",,,Health Line
,,CS: Mmhmm,,,
,,GA: It’s so straight. So straight…,,,
,,"CS: I know, but it's not good that it's there. The less of a health line you have, the better off you are. Which line, which hand is this? Your right hand?",,,Health Line
,,GA: This is my right hand. What I came into the world with.,,,
,0:30:48,CS: And this is your left hand. See–you have all this protection stuff around your life line and you have a very small health [inaudible] but here you’ve got a definite health line [inaudible]. See this shows that I have kind of a delicate,,,Health and Body
0:30:48,0:30:48,[tape stops] End of Track 1,Side A,,
0:00:00,0:00:00,Start of Track 2,Side B,,
0:00:05,0:00:21,"CS: Anyway, you can see the trauma in the early part of my life that was centered around my heart. But that now I’ve been able to clear up a lot of that pain and hurt. And in fact it's given me a great capacity to feel love and compassion for other people.",,,"Heart Line, Relationships"
0:00:21,0:00:38,"GA: Bueno. What about um, like someone told me that I was blocking because my hands are knobbed de aqui? That I was blocking certain things. And when people, when palm readers tell you to do like that, what does that mean?",Discussing the significance of hand shape,,"Instructional, Palmistry, Hand Shape"
0:00:38,,"CS: They wanna see the shape of your fingers and of your hand [yawns] every hand tells you something like, I mean what your hand and fingers tell me is that you have a lot of different capacities for different–you have a lot of different potentials for your energies to go in different directions. You don’t have to be an artist, you don’t have to be a writer, you don’t–you could be a teacher. You could be a mathematician. You could be a worker with your hands. You could work in a cannery. You could–there’s a lot of different things that you are capable of doing. You're not stuck in any one.",,,"Hand Shape, Career, Success"
,,GA: Right.,,,
,,[Crosstalking],,,
,,CS: There were a lot of things that you could have done and done well. Taken care of and…,,,Career
,0:01:33,GA: I used to work a lot with my hands. I worked in a cannery. I have been a seamstress. I have done another craft. I have been a secretary.,,,Career
0:01:33,,"CS: I think that’s what this tells. But [yawns] this knobbiness, I have to check. I’ll ask my mom. I have kind of something like that. And also my. This one. Feel how big that knuckle is right there. The other side…",,,Hand Shape
,,"GA: Oh, si.",,,
,,"CS: It goes fat that way. The other one goes fat the other way. And also my fingers are crooked, like not as much as yours, but they still have that crookedness.",,,Hand Shape
,,"GA: Well it means something that your Apollo finger curves toward the Saturn. I mean, that means something.",,,"Instructional, Apollo Finger, Saturn Finger"
,,CS: Mmhmm. Yeah all that means something but I don’t know how to do that kind of detailed really.,,,
,,"CS: [pause] See on this hand, I had the potential to have great health in this lifetime. I don’t have hardly any health line at all. But the way I’m living is such that I’m bringing the health line here. So that’s just a warning that I have to watch out for my…",,,"Instructional, Health and Body"
,,GA: For your health?,,,
,,"CS: Mmhmm. Wow, I’m able to love a lot more in this lifetime than I was before. And less romantically sort of like you. You’re moving in that direction. But at the cost of my intellectual development. So maybe that’s why I’m working on that now.",,,"Heart Line, Relationships"
,0:03:50,GA: With Rosa? Maybe you have to balance the two. I’m very interested in what happens to this line. The emotional… [long pause],,,Heart Line
0:03:50,,"GA: Thank you! Thank you, thank you, thank you, that was great!",,,
,,CS: De nada,,,
,,GA: Cause you told me stuff nobody else had told me like about the romantic stuff and all that. Nobody had ever said anything about my emotional–my heart line.,,,Heart Line
,,"CS: Huh, that’s funny",,,
,,GA: I had heard the stuff about the fate. But I hadn’t heard anything about the emotional stuff.,,,Emotional Life
,,CS: That’s why I wanted that woman to read our palms when we went there to Long Island.,,,
,,GA: Well she’s still there!,,,
,,"CS: Yeah, but all she did–she doesn’t read palms like I do, she was like this, and then she just does a psychic reading. She doesn’t actually read the lines. Which is a different kind of",,,Psychic
,,GA: Right and she was also taking cards out,,,Tarot
,,CS: So she probably started out with tarot and then just uses the hands as a way of,,,"Tarot, Palmistry"
,,"GA: Well she looked at my hand and she said that my lover-ooh- that his name started with an N, I said oh it’s not a his–it’s not a he, it's a she. So she says A or a B, those are their names.",,,"Relationships, Sexuality, Lesbianism"
,,"CS: Who was that? Remember she said that kind of thing to me too. I wish I would have remembered. She said when I went back, I was gonna get involved with some….",,,
,,GA: Didn’t you get involved with Vivian? Or was that before?,,,
,0:05:19,"CS: We were trying to see if it meant Vivian and it was like–but anyway she didn’t do this kind of palm reading, which I’m still looking for a good palmist to read my hand.",,,
0:05:19,0:05:19,[tape stops],,,